pid,label,caridischo_genre,claimed_genre,link,access,status,language,creators,stewards,blurb,related_to,added_by,twitter,census_year,notes,sub_collections,open_data
cds146,SPAT Memory Project,Thematic Curations,collection,http://spatmemoryproject.org,open,Active,en,Schuyler Esprit ,Create Caribbean ,"SPAT Memory Project is a repository for the publications and related documents of the Dominica-based non-profit organization, Small Projects Assistance Team (locally known as SPAT).",,Schuyler Esprit,@schuyleresprit,2020,,,
cds147,The Cuban American Dream Timeline,Maps & Visualizations,a timeline,http://exhibits.uflib.ufl.edu/cubanamericandream/,open,Active,en,Katiana Bagué Alexis Baldacci,George A Smathers Libraries,"A timeline of events that explore the reasons behind the immigration of Cubans to Florida from the 16th to the 21st century, the pressure that such immigration brought to local and state governments, the reactions of Floridian communities to Cuban immigrants, the ways in which Cuban immigrants adapted to their new reality, and the contribution of Cuban immigration to Florida.",,,,2020,,,
cds148,The Free Womb Project,Thematic Curations,exhibit,https://thefreewombproject.com/,open,Stable,"en, es",Dr. Yesenia Barragan ,Dartmouth College,"Welcome to The Free Womb Project—a bilingual (English and Spanish-language), digital collection of laws legislating the gradual abolition of slavery through “Free Womb” decrees in fifteen different governments across the Atlantic World during the late eighteenth and nineteenth centuries.",,,,2020,,,
cds149,"Slavery: Supporters and Abolitionists, 1675-1865",Thematic Curations,collection,https://microform.digital/boa/collections/69/slavery-supporters-and-abolitionists-1675-1865,vendor,Active,en,,British Online Archives,"Slavery was divisive in its time, see the arguments from slavers and protestors",,Roopika Risam,@roopikarisam,2020,Who writes their taglines? ,,
cds15,Arquitecture of necessity/Arquitectura de la necesidad,Publications & Blogs,blog,http://architectureofnecessity.com/,open,Archived,es,Ernesto Oroza,,Architecture of Necessity is a concept with a double function. It initially operates as a descriptive and austere term in its rhetorical value that points to an architecture of urgency and precariousness. Its second and most important function is metaphorical: it enunciates an architecture that is its own diagram.,,,,2020,,,
cds150,The Work of Man Has Only Just Begun: Legacies of Césaire,Cabinet of Wonders,a forum and a researchathon,https://cesairelegacies.cdrs.columbia.edu/,open,In Disrepair,en,"Kaiama Glover, Alex Gil, Kelly Josephs",Columbia University Libraries,"Poet, statesman, and singular voice of the anti-colonial movements of the 20th century, Aimé Césaire continues to influence contemporary discussions of ethics and aesthetics, politics and history in this precariously postcolonial world. In an effort to contribute to Césaire's living legacy, we have organized an online forum in which four pairs of scholars, from a variety of disciplines, offer reflections along four different critical paths",,Alex Gil,@elotroalex,2020,,,
cds151,The Atlantic Networks Project,Maps & Visualizations,maps,https://sites.google.com/site/atlanticnetworksproject/home?authuser=0,open,Stable,en,Andrew Sluyter,Louisiana State University,"It focuses on mapping the routes of vessels between about 1750 and 1900 that carried cargoes of coffee, sugar, spices, gold, and many other products as well as enslaved Africans between Europe, Africa, the Caribbean, South America, North America, and Asia.",,Roopika Risam,@roopikarisam,2020,,,
cds152,Worker Rebellions in the British Caribbean,Maps & Visualizations,timeline,https://cdn.knightlab.com/libs/timeline3/latest/embed/index.html?source=1qZjyqnjo2e37usoVsGgoZU7ZI5NDA6NCCpp2p0EVb2s&font=Default&lang=en&initial_zoom=2&height=650,open,Stable,en,,Working Class History,"Sample timeline from events detailed in Labour rebellions of the 1930s in the British Caribbean region colonies by Richard Hart, put together for the Working Class History project.",,Kaneesha Parsard,@kaneeshaparsard,2020,,,
cds153,Slavery Images,Thematic Curations,image collection,http://slaveryimages.org/s/slaveryimages/page/welcome,open,Active,en,Henry Lovejoy,"University of Colorado, Boulder","This website is envisioned as a tool and a resource that can be used by teachers, researchers, students, and the general public - in brief, anyone interested in the experiences of Africans who were enslaved and transported to the Americas and the lives of their descendants in the slave societies of the New World.",,Roopika Risam,@roopikarisam,2020,,,
cds154,The Puerto Rican Experience In The U.S. Military: A Century Of Unheralded Service,Thematic Curations,collection,https://centropr.hunter.cuny.edu/digital-humanities/pr-military/puerto-rican-experience-us-military-century-unheralded-service,closed,Active,en,,CUNY,"Centro is a research institute that is dedicated to the study and interpretation of the Puerto Rican experience in the United States and that produces and disseminates relevant interdisciplinary research. Centro also collects, preserves, and provides access to library resources documenting Puerto Rican history and culture. We seek to link scholarship to social action and policy debates and to contribute to the betterment of our community and enrichment of Puerto Rican studies.",,,,2020,,,
cds155,The Afrolatin@ Project,Cabinet of Wonders,project,https://afrolatinoproject.org/,open,Stable,en,,,"Our mission is to serve as a resource center and cultural advocate for documentation and preservation of cultures, histories, and experiences of Afrodescendant people in the Americas and the Caribbean.",,,,2020,,,
cds156,The Public Archive,Publications & Blogs,blog,https://thepublicarchive.com,open,Active,en,Peter Hudson,,"In light of this obliteration of history, The Public Archive was initiated to serve as an accessible clearinghouse of historical essays, archival sources, and informed contemporary journalism on Haiti. The Public Archive compiles links to documents freely accessible through the digital collections of libraries and repositories as well as open-access online periodicals, academic journals and newspapers.",,Kaiama L. Glover,@inthewhirld,2020,,,
cds157,TonyOldies,Thematic Curations,digital archive,http://tonyoldies.homestead.com/,open,Active,en,Tony Hadley,,Photographic cyber museum of vernacular and colonial images,,Emilie Boone,,2020,"NANTON, PHILIP. &quot; Tony's Oldies: Visualising Vincentian Diasporic Memory.&quot;  Caribbean Quarterly 58, no. 2/3 (2012): 101-15. Accessed November 13, 2020. http://www.jstor.org.citytech.ezproxy.cuny.edu/stable/41708780.",,
cds158,"The Other Revolution: Haiti, 1789-1804",Thematic Curations,exhibit,https://www.brown.edu/Facilities/John_Carter_Brown_Library/exhibitions/haitian/index.html,open,Stable,en,"Malick W. Ghachem, Susan Danforth, Leslie Tobias-Olsen","The John Carter Brown Library, Brown University","In many instances the revolutionary spirit can be only dimly perceived through the eye-witness accounts and recollections of literate white colonists and free people of color, but it is there all the same.
The exhibition items have been chosen, and the captions written, so as to provide a running narrative of the Haitian Revolution.",,Kaneesha Parsard,@kaneeshaparsard,2020,,,
cds159,thepostarchive,Thematic Curations,archive,https://youtube.com/c/thepostarchive,open,Active,"en, es, fr",,,Youtube channel that tends to have many Carribbean writers and artists featured on it.,,,,2020,,,
cds16,Bibliography for &quot; runaway&quot;  enslaved people,Reference,a bibliography,https://docs.google.com/document/d/16oamSiSVIzrI6Sd_wvPSXVNlNscEhG71GwsLH27WaK0/edit,open,In Development,en,Amalia S. Levi & Dr. Paola A. Schiappacasse,,Bibliography developed during the public workshops for the &quot; Barbados Runaways&quot;  collection.,,Amalia S. Levi,@amaliasl,2020,,,
cds160,US Caribbean & Ethnic Florida Digital Newspaper Project,Publications & Blogs,blog,http://ufndnp.domains.uflib.ufl.edu/,open,Active,"en, es","University of Florida: Melissa Jerome, Sarah &quot; Moxy&quot;  Moczygemba ",University of Florida: Melissa Jerome,"Blog that features/contextualizes newspaper content digitized by the US Caribbean & Ethnic Florida Digital Newspaper Project. Newspapers published between 1800-1963 that are chosen for digitization for this project come from Florida, Puerto Rico and the Virgin Islands and are made openly available for access via the Library of Congress site, Chronicling America (https://chroniclingamerica.loc.gov/) as well as in the Digital Library of the Caribbean (dLOC) and the University of Florida Digital Collections (UFDC)",cds31,Melissa Jerome,@mmespino20,2020,"over 150,000 pages of historic Puerto Rican newspapers (from 4 unique titles of historic significance) are currently available for viewing & text searching; More Puerto Rico content and content from Virgin Islands is being digitized and will be made avalable over the next year. ",,
cds161,Visualizing Sovereignty,Maps & Visualizations,"a story-telling, community-building, and solidarity economy project",https://player.vimeo.com/video/169690419?autoplay=1,open,Stable,en,"Yarimar Bonilla, Max Hantel",Rutgers University,Animated video designed by Yarimar Bonilla (Rutgers University) and Max Hantel (Dartmouth College) for the journal SXArchipelagos.,,Kaiama L. Glover,@inthewhirld,2020,,,
cds162,Traveling Caribbean Heritage,Thematic Curations,exhibit,https://www.kitlv.nl/traveling-caribbean-heritage/,open,In Development,"en, nl",Rose Mary Allen et al. ,KITLV/Royal Netherlands Institute of Southeast Asian and Caribbean Studies,"In this project, Caribbean and Dutch scholars and cultural heritage specialists address these questions, identifying and questioning the dynamics of heritage formation, and developing a multi-generational human resource base as well as a digital infrastructure for the preservation of insular cultural heritage, for outreach activities, and ultimately for stimulating the sustainable development of these non-sovereign SIDS.",,Roopika Risam,@roopikarisam,2020,,,
cds163,The Puerto Rico Citizenship Archives Project,Thematic Curations,digital archive,https://scholarscollaborative.org/PuertoRico/,open,Stable,en,Charles R. Venator-Santiago ,University of Connecticut,The Puerto Rico Citizenship Archives Project (PRCAP) is part of a public repository designed to document the legal history of the extension of citizenship to the U.S. territories. The PRCAP provides a comprehensive overview of 120+ year story of debates over the extension of citizenship to Puerto Rico. It also provides public access to the key historical documents shaping this history. The main goal is to create a reliable public archive of primary documents that can foster new research projects on Puerto Rico and its relationship to the United States as well as on broader visions of U.S. citizenship.,,,,2020,,,
cds164,Unmapping the Caribbean: Cuban Santería,Cabinet of Wonders,multimedia exhibit,https://nyuds.maps.arcgis.com/apps/Cascade/index.html?appid=510f57634a2940e0abaca2be46207384,open,Stable,en,,NYU,"Cuban Santería is a hybrid religion drawing from the Catholic doctrine imposed by Spanish colonialists, and the Yoruba religions brought by enslaved Africans.",,Tao Leigh Goffe,@taoleighgoffe,2020,,,
cds165,Valor y Cambio,Cabinet of Wonders,proyect,https://www.valorycambio.org,open,Stable,"en, es","Frances Negrón-Muntaner, Sarabel Santos-Negrón",,"Valor y Cambio is a story-telling, community-building, and solidarity economy project started by artist Frances Negrón-Muntaner and collaborator visual artist Sarabel Santos Negrón.",,Roopika Risam,@roopikarisam,2020,,,
cds166,Two Plantations,Maps & Visualizations,a diagram and a family tree,http://www.twoplantations.com,open,Stable,en,Vincent Brown,,This website displays research into the lives of 431 enslaved people in seven multi-generational families at Mesopotamia plantation in Jamaica and Mount Airy plantation in Virginia.,,Kaiama L. Glover,@inthewhirld,2020,,,
cds167,AfroMix,Reference,portal,https://www.afromix.org/,open,Active,en,,,"The Portal of African and Caribbean Cultures. News, music, arts and culture, society, travel, events.",,,,2020,,,
cds168,Manioc,Digital Libraries,digital library,http://www.manioc.org/,open,Active,fr,,"Université des Antilles, L'Université de Guyane","Manioc est une bibliothèque numérique spécialisée sur la Caraïbe, l'Amazonie, le Plateau des Guyanes et les régions ou centres d'intérêt liés à ces territoires. Vous y trouverez des documents textuels, sonores, iconographiques et des références concernant l'histoire culturelle, sociale, économique ou politique de ces pays.",,,,2020,,,
cds169,Protestitas,Cabinet of Wonders,poetry bot,https://twitter.com/protestitas,open,Active,es,Leonardo Flores,,A Twitter Bot providing social commentary and activism related to Puerto Rico,,Alex Gil,@elotroalex,2020,,,
cds17,Banque Numérique des Patrimoines Martiniquais,Digital Libraries,banque numérique,https://www.patrimoines-martinique.org/,open,Active,fr,,,"Initiated by the former General Council of Martinique, the Banque Numérique des Patrimoines Martiniquais is an access portal to documentary resources on the cultural and historical heritage of Martinique backed by the geographic information system of Martinique (SIGMA).",,,,2020,,,
cds170,"Documentation of the Sidney Martin Library Art Collection, UWI (Cave Hill Campus)",Thematic Curations,documentation,[not available yet],private,In Development,en,Amalia S. Levi,,"Project to document the Sidney Martin Library collection with archival material and photos. Public-facing omeka site created, but not yet activated.",,Amalia S. Levi,@amaliasl,2020,,,
cds18,Biblioteca Nacional Aruba: Coleccion Digital,Digital Libraries,colección digital,https://archive.org/details/bibliotecanacionalaruba&sort=date,open,Archived,es,Biblioteca Nacional Aruba,Internet Archive,Digital Collection of the Aruba National Library.,,Alex Gil,@elotroalex,2020,,,
cds19,Age of Revolutions,Publications & Blogs,"an open-access, peer-reviewed academic journal",https://ageofrevolutions.com/,open,Active,en,Bryan Banks Cindy Ermus,,"The word “revolution” is a human tool. At any point in time, its meaning has shifted to accommodate those wielding it. By establishing a site like this — Age of Revolutions — we are participating in the humanities, surveying revolutionary changes in history, encouraging the comparative study of revolutions, and exploring the hopes imbued in the term “revolution.”",,,,2020,,,
cds2,...... et les chiens se taisaient,Scholarly Editions,a scholarly edition,http://cesaire.elotroalex.com/chiens/,open,Stable,"en, fr",Alex Gil,,"During the height of the fascist Vichy regime in Martinique, Aimé Césaire was secretly at work on a forceful historical drama with the title &quot; ...... Et les chiens se taisaient&quot; —&quot; ...... and the Dogs Were Silent.&quot;  The plot of the drama follows the events of the Haitian Revolution and the tragic destiny of its leader, Toussaint L’Ouverture, determined to die betrayed in a frozen cell in the Jura mountains rather than compromise his truth.",,Alex Gil,@elotroalex,2020,,,
cds20,19th Century Caribbean Cholera Timemap,Maps & Visualizations,a timemap,"http://caribbeancholera.org/cholera_timemap11.html#zoom=5&center=20.13847031245115,-74.3994140625&date=1853-05-01",open,In Disrepair,en,Deborah Jenson et al.,"John Hope Franklin Humanities Institute, Duke University","This timemap locates the main cholera outbreaks in the Caribbean in the 19th century, citing the journalistic sources at the time of each outbreak.",,Roopika Risam,@roopikarisam,2020,,,
cds21,Academia Historia Dominicana: Revista Clío,Thematic Curations,publicaciones,https://www.academiadominicanahistoria.org.do/?page_id=53,open,Active,es,Dr. Federico Henríquez y Carvajal,,"The Dominican Academy of History was created by Decree No. 186 of July 23, 1931. With the primary objective of knowing and studying the past in general, and mainly that of the Dominican nation.",,,,2020,,,
cds22,Caribbean Literary Heritage,Cabinet of Wonders,a project,https://www.caribbeanliteraryheritage.com/,open,Active,en,Project team led by Alison Donnell,,"Caribbean Literary Heritage is a project funded by the Leverhulme Trust that promotes literary and archival preservation in the Caribbean and the diaspora, as well as bridging connections between the literary past and present with an interest in exploring the new challenges and possibilities of born digital initiatives.",,Nadine Zubair,@NadineZubair,2020,,,
cds24,Beyond the Sugar Curtain,Publications & Blogs,a project,https://www.brown.edu/research/projects/tracing-cuba-us-connections/home-inicio,open,Active,"en, es",Jennifer Lambe,Brown University,"Initiated by the former General Council of Martinique, the Banque Numérique des Patrimoines Martiniquais is an access portal to documentary resources on the cultural and historical heritage of Martinique backed by the geographic information system of Martinique (SIGMA).",,Roopika Risam,@roopikarisam,2020,,,
cds25,Archivo Mesoamericano,Thematic Curations,archivo,https://archivomesoamericano.org/,open,Active,"es, en",,"Digital Collection Services, Indiana University","El Archivo Mesoamericano representa un archivo digital que consiste de grabaciones históricas y etnográficas, montado en colaboración con estas instituciones respectivas: el Centro de Investigaciones y Estudios Superiores en Antropología Social (CIESAS, México), el Instituto de Historia de Nicaragua y Centroamérica (IHNCA, Nicaragua), y el Museo de la Palabra y la Imagen (MUPI, El Salvador). / Archivo Mesoamericano is a digital archive of annotated historical and ethnographic video materials created in collaboration with the Center for Research and Advanced Studies in Social Anthropology (CIESAS) in Mexico, the Institute of History of Nicaragua and Central America (IHNCA) in Nicaragua, and the Museum of the Word and the Image (MUPI) in El Salvador.",,Mary Borgo Ton,@maryeborgo,2020,,,
cds26,A Boricua Abroad,Publications & Blogs,[blog],https://aboricuaabroad.wordpress.com/,open,Stable,en,Jennifer Caroccio,,"Jennifer Caroccio is a doctoral student in the American Studies Program at Rutgers-University-Newark. Her research interests are in U.S. Latin@ culture & literature, folktales, and graphic novels. Employing Women of Color Feminist, Postcolonial, and Critical Race theories, she examines issues of racial identity and misogyny in Caribbean and Caribbean-American texts.",,Roopika Risam,@roopikarisam,2020,,,
cds27,The Barbadian,Thematic Curations,digitization,https://eap.bl.uk/project/EAP1251,open,Active,en,"Amalia S. Levi, et al",Endangered Archives Programme,Digitized historical newspaper &quot; The Barbadian&quot;  (1822-1863).,,Amalia S. Levi,@amaliasl,2020,,,
cds28,Barbados Ephemera Collection,Thematic Curations,digitized ephemera,https://meap.library.ucla.edu/ephemera-barbados,open,In Development,en,Amalia S. Levi; Modern Endangered Archives Program,Modern Endangered Archives Program,Digitized ephemera material from the Barbados Archives.,,Amalia S. Levi,@amaliasl,2020,,,
cds29,Caribbean Literature,Thematic Curations,collection,https://alexanderstreet.com/products/caribbean-literature,vendor,Active,en,,Alexander Street Press,"The literature of the Caribbean is exceptional, both in language and subject. More than a million and a half Africans, along with many Indians and South Asians, were brought to the Caribbean between the 15th and 19th centuries. Today, their descendants are active in literature and the arts, producing literature with strong and direct ties to traditional African expressions. This literary connection, combined with the tales of survival, exile, resistance, endurance, and emigration to other parts of the Americas, makes for a body of work that is essential for the study of the Caribbean and the Black Diaspora—and indeed central for our understanding of the New World.",,Alex Gil,@elotroalex,2020,,,
cds3,AImé Césaire: Open Blibiography on Zotero,Reference,a bibliography,https://www.zotero.org/groups/232193/aime_cesaire/library,open,In Disrepair,"en, fr","Alex Gil, et al",,A Zotero collection of primary and secondary sources by and about Martinican poet Aimé Césaire.,,,,2020,,,
cds30,Coasts in Crisis: Caribbean Arts and Cultures after Hurricanes,Cabinet of Wonders,a platform,http://coastsincrisis.net/,open,In Development,"en, es",Charlotte Rogers,University of Virginia,This a digital space that explores the cultural meaning of the hurricane through Caribbean art. It features work from artists who experienced Hurricanes Irma and María in 2017 and gathered at the University of Virginia on September 2019 to present and discuss their work.,,Winnie Pérez Martínez,@_wepm,2020,,,
cds31,Digital Library of the Caribbean,Digital Libraries,digital library,https://www.dloc.com/,open,Active,"en, fr, es, du, ht",UFL/FIU,UFL/FIU,The Digital Library of the Caribbean (dLOC) is a cooperative digital library for resources from and about the Caribbean and circum-Caribbean.,,Alex Gil,@elotroalex,2020,,,
cds32,CUNY Dominican Institute Publications ,Publications & Blogs,publications,https://academicworks.cuny.edu/dsi_pubs/,open,Stable,en,,CUNY Dominican Studies Institute,"CUNY Academic Works is a service of the CUNY Libraries dedicated to collecting and providing access to the research, scholarship, and creative and pedagogical work of the City University of New York. In service to CUNY’s mission as a public university, content in Academic Works is freely available to all.",,,,2020,,,
cds33,Carisealand,Cabinet of Wonders,digital research project,http://archipelagosjournal.org/issue04/esprit-carisealand.html,open,In Development,en,Schuyler Esprit,,"The Carisealand (Caribbean Sea and Land) digital research project, launched in 2015 by scholar, teacher, and activist Schuyler K Esprit, provides an interactive framework within which to imagine a more sustainable way of life for Caribbean people, both in the present day and in the future. The project aims to create awareness around the impact of climate change in the Caribbean region; to initiate and sustain collaborations with scholars and artists in an effort to find solutions to social injustices resulting from climate change activity; and to present models for alternate Caribbean futures.",,Kaiama L. Glover,@inthewhirld,2020,,,
cds34,Caribbean Memory Project,Thematic Curations,collection of archives,https://www.caribbeanmemoryproject.com/,open,Active,en,"Kevin Adonis Browne, Dawn Cumberbatch",,"​The Caribbean Memory Project promotes public awareness and participation in the collection and circulation of everyday archives for cultural, social, and historical research.",,Kaiama L. Glover,@inthewhirld,2020,,,
cds35,Carmelita Tropicana Online Digital Archive,Thematic Curations,digital archive,http://tropicanavideoarchive.blogspot.com/,open,In Disrepair,en,Laura Lomas et al. ,,An online video archive of performances by Carmelita Tropicana,,Roopika Risam,@roopikarisam,2020,,,
cds36,Caribbean Religious Trials,Reference,website,https://www.caribbeanreligioustrials.org/,open,In Development,en,Diana Paton et al.,University of Edinburgh,This website presents information about selected trials for religious crimes held in the Caribbean between the 1760s and the 1980s.,,Roopika Risam,@roopikarisam,2020,,,
cds37,Caribbean Review of Gender Studies,Publications & Blogs,academic journal,https://sta.uwi.edu/crgs/,open,Active,en,Institute for Gender and Development Studies,UWI St. Augustine,"The Caribbean Review of Gender Studies stimulates cross-cultural exchanges among Caribbean peoples within the region, those in the Caribbean Diaspora, as well as those who bring a comparative perspective to bear on Caribbean gender and feminist concerns. The journal is established around an identity and voice emanating from Caribbean realities of power in gender, sexualities, ethnicity and class relations, and their effects. The journal welcomes critical disciplinary or multi-disciplinary scholarly articles and creative contributions that broaden networks and enhance the global understanding and reach of Caribbean feminist theory and praxis.",,Alex Gil,@elotroalex,2020,,,
cds38,Collections of Cultural Property | Centro León,Digital Libraries,eMuseum,https://centroleon.org.do/cl/,closed,Active,es,María Amalia León de Jorge,,"The Eduardo León Jimenes Cultural Center (León Center) is located in the city of Santiago de los Caballeros, Dominican Republic. It was devised by the León Asensio brothers to honor the memory of their parents while giving the country an institution for its educational and cultural development. It opened its doors in October 2003 with various spaces that are used for public and private activities, both inside and around the main building, it has four exhibition rooms, a multipurpose activity room, classroom, educational workshop, auditorium, media library, cafeteria, shop , Caribbean patio and gardens, all of which comply with the international standards established by ICOM / UNESCO for their design and operation.",,,,2020,,,
cds39,Dark Laboratory,Cabinet of Wonders,a laboratory,https://www.darklaboratory.com/,open,Active,en, Tao Leigh Goffe Jeffrey Palmer,,"The Dark Laboratory is an engine for collaboration, design, and study of Black and Indigenous ecologies through creative technology.",,Tao Leigh Goffe,@taoleighgoffe,2020,,,
