pid,label,caridischo_genre,claimed_genre,link,access,status,language,creators,stewards,blurb,related_to,added_by,twitter,census_year,notes,sub_collections,open_data
cds1,archipelagos journal,Publications & Blogs,an academic journal,http://archipelagosjournal.org/,open,Active,"en, fr, es","Kaiama Glover, Alex Gil",Columbia University Library,"archipelagos is a born-digital, peer-reviewed publication devoted to creative exploration, debate, and critical thinking about and through digital practices in contemporary scholarly and artistic work in and on the Caribbean. Given the wide implications of the “digital turn” for our very conceptions of knowledge, our mission is to discern the ways in which the digital may enhance and transform our comprehension of the regional and diasporic Caribbean. archipelagos responds to this challenge with three distinct dimensions of critical production: scholarly essays; digital scholarship projects; and digital project reviews.",,Alex Gil,@elotroalex,2020,,,
cds10,.break .dance: a choreo-essay,Cabinet of Wonders,a choreo-essay,http://smallaxe.net/sxarchipelagos/issue03/parham/parham.html,open,Active,en,Marisa Parham,,".break .dance is a time-based web experience opened in response to a prompt for a SX Archipelagos issue, launched by Alex Gil and Kaiama Glover, and guest-edited by Jessica Marie Johnson",,Schuyler Esprit,@schuyleresprit,2020,,,
cds100,Le marronnage dans le monde atlantique: Sources et trajectoires de vie,Thematic Curations,a corpus,http://www.marronnage.info/fr/index.html,open,Stable,fr,Jean-Pierre Le Glaunec Léon Robichaud,Université de Sherbrooke Groupe d'Histoire de l'Atlantique Français Fonds de Recherche Société et Culture Québec Conseil de Recherche en Sciences Humaines du Canada ,"Initiative portée par le Groupe d'histoire de l'Atlantique Français (FRQSC) en collaboration avec le projet « SHADD Biography Project: Testimonies of West Africans from the Era of the Slave Trade » (CRSH) , « Le marronnage dans le monde atlantique » vise à décloisonner les archives de l'esclavage. En ligne depuis 2009, cette plateforme permet d’interroger un corpus inédit et évolutif composé de plus de 20 000 documents portant sur l’une des principales formes de résistance à l’esclavage.",,,,2020,,,
cds101,La Médi@thèque Numérique de Guadeloupe,Digital Libraries,une médiathèque,https://guadeloupe.mediatheques.fr/,open,Stable,fr,La Médiathèque Caraïbe (LAMECA),La Médiathèque Caraïbe (LAMECA),"La Médi@thèque Numérique de Guadeloupe is part of the Caribbean Media Library (LAMECA) project proposed by the General Council of Guadeloupe in order to federate documentary resources relating to the countries of the Caribbean basin by creating documentary tools making it possible to identify, locate or even exchange documents.",,,,2020,,,
cds102,National Library of Jamaica Digital,Digital Libraries,a digital library,https://nlj.gov.jm/digital-collections/,open,Active,en,,National Library of Jamaica,"To enhance access to its rich and varied collections, the National NLJ has digitized thousands of historical photographs, prints, drawings, pamphlets, programmes, manuscripts, books, rare maps and other rare and unique materials.",,Roopika Risam,@roopikarisam,2020,Lots of subcollections. I have thoughts about managing subcollections,https://nlj.gov.jm/digital-collections/,
cds103,New Netherlands Online Publications,Thematic Curations,online publications,https://www.newnetherlandinstitute.org/research/online-publications/,open,Active,"en, du",,New Netherland Institute,"The New Netherland Institute is making available digitized versions of translations and transcriptions of documents relating to New Netherland. Written in an archaic hand, these seventeenth-century documents were damaged by fire and water, but they are our best source of knowledge about the former Dutch colony. Available on this website are government records held by the New York State Archives, private and corporate papers from the collections of the New York State Library, and selected documents from other repositories. Scanned originals of many of these documents are available on the websites of the New York State Archives and New York State Library.",,,,2020,,,
cds104,Facing Climates of Inequality after Dorian,Thematic Curations,an exhibit,https://sites.google.com/view/digital-humanities-ub-north/climates-of-inequality-grand-bahama,open,Defunct,en,Ian Strachan et al.,"Climates of Inequality, Digital Humanities @ UB-North, University of Bahamas North","This exhibit presents stories of climate and environmental justice that emerge from local, community-based research projects by students in collaboration with local NGOs",,Roopika Risam,@roopikarisam,2020,,,
cds105,Puerto Rico Syllabus,Reference,a syllabus,https://puertoricosyllabus.com,open,Active,"en, es",Yarimar Bonilla,,"The materials gathered help place the current moment within the larger political, social, and economic history of this U.S. territory and illuminate how both the crisis and its proposed solutions are impacting the daily lives of millions of Puerto Ricans both within the territory and across its growing diaspora.",,Kaiama L. Glover,@inthewhirld,2020,,,
cds106,"Migration, Mobility, Sustainability: NEH Institute for Advanced Topics in the Digital Humanities",Cabinet of Wonders,an institute,http://nehcaribbean.domains.uflib.ufl.edu/,private,In Development,en,http://nehcaribbean.domains.uflib.ufl.edu/contributors/,University of Florida; Digital Library of the Caribbean,"Funded by the National Endowment for the Humanities, this institute was designed to give participants experience incorporating tools and openly accessible collections for developing a community of practice around digital pedagogy and teaching. Participants convened through in-person and virtual sessions over the course of 2019-2020. This web publication highlights their work and encourages further sharing and collaboration.",,Perry Collins,@perrycollins,2020,,,
cds107,Islands in the North,Maps & Visualizations,"a map, a timeline and a database",http://about.islandsinthenorth.com/,open,Active,en,Marlene Gaynair,Rutgers Digital Humanities Initiatives,"This digital project (re)creates the space and place of Black Canadian/West Indian immigrants in twentieth century Toronto, Canada.",,Roopika Risam,@roopikarisam,2020,,,
cds108,Making of Caribbean Feminisms,Cabinet of Wonders,a project,https://sta.uwi.edu/igds/mcf/,open,Stable,en,Institute for Gender and Development Studies,UWI St. Augustine,"This Making of Caribbean Feminisms project is founded on the belief that the impulse to further feminist theorising and activism needs to be transmitted to a younger generation. One of the outcomes has been the creation of a Special Collection on Caribbean Feminisms which is now housed in the West Indiana and Special Collections section and the UWISpace online archives of The UWI Alma Jordan Library, St. Augustine Campus",,Alex Gil,@elotroalex,2020,,,
cds109,Memoria de la Nación Cubana / Memory of the Cuban Nation,Thematic Curations,an exhibit,https://www.memoryofnations.eu/en/memory-cuban-nation-instrument-transformation-cuban-society-real-freedom,open,Stable,"en, pl, cz","Post Bellum, Florida International University",Post Bellum,"In 2017, Post Bellum, in cooperation with Florida International University, created the project ""Memory of the Cuban Nation: instrument for the transformation of Cuban society towards true freedom"" to honor Cuban dissidents and activists. This project, funded by the Ministry of Foreign Affairs of the Czech Republic through the Cooperation for Transformation Program, fulfills its purpose of collecting the testimonies and personal experiences of dissidents who oppose the totalitarian regime in Cuba.",,Roopika Risam,@roopikarisam,2020,,,
cds11,Archives Nationales d'Outre Mer: Archives Numérisées,Digital Libraries,des archives numérisees,http://anom.archivesnationales.culture.gouv.fr/ir?classification=archives_numerisees,open,Stable,fr,,,"A service with national competence installed in Aix-en-Provence since 1966, the National Archives of Overseas (ANOM) are responsible for the conservation, communication and collection of archives of the French colonial expansion.",,,,2020,,,
cds110,Proyecto Humboldt Digital,Thematic Curations,una iniciativa internacional,https://habanaberlin.hypotheses.org/,open,In Development,"de, es",Tobias Kraft et al.,"Casa Museo Alejandro de Humboldt (La Habana), Academia de Ciencias y Humanidades Berlín-Brandeburgo ",El Proyecto Humboldt Digital (ProHD) es una iniciativa internacional para la capacitación en las Humanidades Digitales que se ejecuta en dos lugares: La Habana (Casa Museo Alejandro de Humboldt) y Berlín (Academia de Ciencias y Humanidades Berlín-Brandeburgo).,,Roopika Risam,@roopikarisam,2020,,,
cds111,Obeah Histories,Thematic Curations,an exhibit,https://obeahhistories.org/,open,Stable,en,Diana Paton et al.,Newcastle University,Researching Prosecution for Religious Practice in the Caribbean,,Roopika Risam,@roopikarisam,2020,,,
cds112,Manioc Blog,Publications & Blogs,a blog,manioc-blog.blogspot.com,open,Active,fr,,,"Digital library: Caribbean, Amazonia, Guyana",,,,2020,,,
cds113,Nancy Prince: A Transamerican Archive,Thematic Curations,a transamerican archive,https://nancyprince.omeka.net/,open,In Development,en,,Florida International University Libraries,A multimedia exhibit around the life of Nancy Prince.,,Roopika Risam,@roopikarisam,2020,,,
cds114,edition humboldt digital,Scholarly Editions,an edition,https://edition-humboldt.de/,open,Active,"de, en","Ottmar Ette, et al",Berlin-Brandenburg Academy of Sciences and Humanities,"Digital edition of Humboldt's papers, including The American Travel Journals.",,,,2020,,,
cds115,Plenamar,Publications & Blogs,an online cultural magazine,https://plenamar.do/,open,Active,es,"Minerva del Risco,Rafael Emilio Yunén, Fausto Rosario, José Mármol and Jochy Herrera",Acento.com.do,"Published weekly, Plenamar is a Dominican-based online magazine focused on local and international cultural production.",,,,2020,,,
cds116,One More Voice,Thematic Curations,a collection,https://onemorevoice.org/,open,Active,en,Adrian S. Wisnicki,,One More Voice focuses on recovering non-European contributions from nineteenth-century British imperial and colonial archives.,,Adrian Wisnicki,@AdrianWisnicki,2020,,,
cds117,Latino Genealogy & Beyond: diasporic journeys across time and space,Publications & Blogs,blogs,https://latinogenealogyandbeyond.com,open,Active,en,Ellen Fernandez-Sacco,,"Mabrika! Join me, Ellen Fernandez-Sacco as I research ancestors and discuss genealogy research with a Caribbean focus.",,Ellen Fernandez-Sacco,@efsacco,2020,,,
cds118,Mapping Slavery,Maps & Visualizations,maps,https://mappingslavery.nl/en/,open,Stable,"en, nl, id",,,Mapping Slavery NL portrays historical places relating to slavery on the map of the Dutch colonial empire.,,,,2020,,,
cds119,sx salon,Publications & Blogs,a journal,http://smallaxe.net/sxsalon,open,Active,en,Kelly Baker Josephs,Small Axe,"Our digital forum for innovative critical and creative explorations of Caribbean literature, broadly defined. Caribbean creative writing has always wrestled with the idea of an aesthetic form that engages regional and diasporic understandings of our changing realities. As a forum, sx salon aims to stimulate these sensibilities and preoccupations across different literary genres. Initiated in 2010, sx salon appears three times per year (February, June, and October). We publish literary discussions, interviews with writers, reviews of new publications (creative and scholarly), and poetry and prose by Caribbean writers.",,Alex Gil,@elotroalex,2020,,,
cds12,Alternative Considerations of Jonestown and Peoples Temple,Thematic Curations,a digital humanities project; annotated documents,https://jonestown.sdsu.edu/?page_id=70587,open,Active,en,"Fielding M. McGehee, Rebecca Moore",San Diego State University,This website is designed to give personal and scholarly perspectives on a major event in the history of religion in America.,,Roopika Risam,@roopikarisam,2020,,,
cds120,"Memory, Mourning, and Reslience in Grand Bahama",Thematic Curations,an exhibit,https://web.archive.org/web/20210127055315/https://culturalmemorybahamas.com/,open,In Disrepair,en,Sally Everson et al.,The University of The Bahamas-North,Enjoy our stories,,Roopika Risam,@roopikarisam,2020,,,
cds121,Mi María,Cabinet of Wonders,a mass-listening project,https://mimariapr.org/,open,In Development,en,Ricia Anne Chansky,UPRM,Mi María: Puerto Rico after the Hurricane is a mass-listening project that collects and circulates stories of Puerto Ricans who have survived Hurricane María and are trying to survive its aftermaths amidst innumerable humanitarian concerns and social justice issues.,,Roopika Risam,@roopikarisam,2020,,,
cds122,Slave Societies Digital Archive,Thematic Curations,a digital archive,https://www.slavesocieties.org,open,Active,en,Jane Landers,,"The Slave Societies Digital Archive (formerly Ecclesiastical and Secular Sources for Slave Societies), directed by Jane Landers and hosted at Vanderbilt University, preserves endangered ecclesiastical and secular documents related to Africans and African-descended peoples in slave societies. SSDA holdings include more than 700,000 digital images drawn close to 2,000 unique volumes dating from the sixteenth through twentieth centuries that document the lives of an estimated four to six million individuals. This collection contains the most extensive serial records for the history of Africans in the Atlantic World, and also includes valuable information about the indigenous, European, and Asian populations who lived alongside them.",,Kaiama L. Glover,@inthewhirld,2020,,,
cds123,Mapping the Haitian Revolution,Maps & Visualizations,an interactive map and timeline,https://www.mappinghaitianrevolution.com/,open,Active,en,"Stephanie Curci, Christopher Jones, Axis Maps","Stephanie Curci, Christopher Jones","A map and timeline of the Haitian Revolution, with additional educational resources designed for high school students.",cds124,Stephanie Curci,"@stephcurci,@theunionmarches",2020,,,
cds124,Mapping Haitian History,Thematic Curations,a historical visual records project,http://www.mappinghaitianhistory.com/,open,Active,"en, fr, ht",Stephanie Curci,Stephanie Curci,"A trilingual Haitian historical records site. Visual preservation of Haïtian historical, natural, and cultural sites. Offering a visual road map to some of Haiti's best features--for research and more. Where possible, links are provided to external documentation (such as ISPAN).",cds123,Stephanie Curci,@stephcurci,2020,,,
cds125,"RSHHGG Lab: Online Index and Lab for the Revue de la Société Haïtienne d’Histoire, de Géographie et de Géologie",Reference,a collection,http://rshhgglab.com/,open,Stable,"en, fr, ht",,,"Online Index and Lab for the Revue de la Société Haïtienne d’Histoire, de Géographie et de Géologie.",,,,2020,,,
cds126,Santería Music Database,Reference,a database,http://furius.ca/santeriadb/,open,Stable,"en, es",Martin Blais,,"Welcome to the Santería music database, a collection of information about afro-cuban folkloric music. The main purpose of this database is to cross-reference the different resources and recordings to the batá drum rhythms (&quot; toques&quot; ) and chants (&quot; cantos&quot; ) of the Santería religion.",,,,2020,,,
cds127,Slave Revolt in Jamaica,Maps & Visualizations,maps,http://revolt.axismaps.com,open,Active,en,Vincent Brown,,"This animated thematic map narrates the spatial history of the greatest slave insurrection in the eighteenth century British Empire. To teachers and researchers, the presentation offers a carefully curated archive of key documentary evidence. To all viewers, the map suggests an argument about the strategies of the rebels and the tactics of counterinsurgency, about the importance of the landscape to the course of the uprising, and about the difficulty of representing such events cartographically with available sources.",,Kaiama L. Glover,@inthewhirld,2020,,,
cds128,Tan Listwa,Publications & Blogs,a blog,https://tanlistwa.com/,open,Active,"en, fr",Jessica Pierre-Louis,,"Welcome to the Martinican company Tan Listwa. As a historian, I provide you with the skills of a researcher and a trainer in humanities studies. Specialised in history and heritage of the Caribbean, I carry out missions of research engineering, training, and assistance for your genealogical research.",,,,2020,,,
cds129,Ramble Bahamas,Maps & Visualizations,a tour,http://ramblebahamas.org,open,Active,en,"Tracey Thompson, Jessica Dawson",The Oral & Public History Institute of the University of The Bahamas,"“From Dat Time”: The Oral & Public History Institute of the University of The Bahamas invites you to explore Ramble Bahamas. The site can be explored by browsing individual stories, browsing Rambles, or through interacting with the map. Each place-based story includes a narrative which centers on an historically significant site or object.",,Kaiama L. Glover,@inthewhirld,2020,,,
cds13,A Colony in Crisis,Thematic Curations,a curation and translations,https://colonyincrisis.lib.umd.edu,open,Active,"en, ht","Abby R. Broughton, Kelsey Corlett-Rivera, Nathan H. Dize, Brittany de Gail",Vanderbilt University,The website is designed to provide online access to both the French originals and the English translations of key primary sources dealing with the grain shortage faced by the colony of Saint-Domingue in 1789,,Kaiama L. Glover,@inthewhirld,2020,,,
cds130,Radio Haiti Archive (Radio Haïti-Inter),Thematic Curations,a digital collection,https://repository.duke.edu/dc/radiohaiti,open,Active,"en, ht, fr","Laura Wagner (Radio Haiti Archivist), Craig Breaden (Audiovisual Archivist), Tanya Thomas, Krystelle Rocourt, Catherine Farmer, Eline Roilllet (student assistants), and other Duke Libraries staff",Duke University (Rubenstein Library),"Complete audio archive of Haiti's first and most prominent independent radio station, Radio Haïti-Inter (Jean L. Dominique and Michèle Montas). Funded by the National Endowment for the Humanities and the Council on Library and Information Resources",,Laura Wagner,,2020,,,
cds131,Repeating Islands,Publications & Blogs,a blog,https://repeatingislands.com/,open,Active,en,"Ivette Romero-Cesareo, Lisa Paravisini-Gebert",,"News and commentary on Caribbean culture, literature, and the arts",,Roopika Risam,@roopikarisam,2020,,,
cds132,The Barbados Synagogue Restoration Project,Thematic Curations,a collection,https://dloc.com/ibsrp,open,Active,en,Amalia S. Levi; Digital Library of the Caribbean,Digital Library of the Caribbean,"Digitized archives from the restoration works of the &quot; Nidhe Israel&quot;  Synagogue in Bridgetown, Barbados.",cds31,Amalia S. Levi,@amaliasl,2020,,,
cds133,The Barbados Mercury and Bridgetown Gazette,Thematic Curations,public workshops,https://barbadosmercury.wordpress.com/the-barbados-mercury-and-bridgetown-gazette/,open,Active,en,Amalia S. Levi,The HeritEdge Collection,The Barbados Mercury and Bridgetown Gazette ​was ​printed​ ​bi-weekly​ ​in​ ​Barbados. The Department of​ ​Archives holds ​the​ ​most​ ​complete​ ​set​ ​of​ ​volumes​ ​of​ ​​The Gazette (20 volumes covering 28 years between 1783-1848).,,Roopika Risam,@roopikarisam,2020,,,
cds134,Oliwon Lakarayib,Cabinet of Wonders,a portal,http://oliwonlakarayib.com/,open,Active,fr,Elsa Juston,,"Our digital platform dedicated to the Caribbean.
Each month, videos and podcasts in history, geography, humanities and social sciences.",,,,2020,,,
cds135,The Black British Map,Maps & Visualizations,maps,https://theblackbritishmap.wordpress.com/,open,In Development,en,Liberty Martin,,"A map of Black British protests, uprisings and battles throughout the 20th century",,Liberty Martin,,2020,From The Caribbean Digital seminar,,
cds136,Radio Haiti (Pilot site),Thematic Curations,a digital collection,http://radiohaitilives.com/,open,Active,"en, ht, fr","Laura Wagner, Meagan Bonnell, Laurent Dubois",Duke University (Forum for Scholars and Publics),"Pilot website for the Radio Haiti project, created by the Forum for Scholars and Publics before the bulk of the collection was digitized",,Kaiama L. Glover,@inthewhirld,2020,edited by Laura Wagner,,
cds137,Saint-Domingue Lost: Imperial French Narratives of the Haitian Revolution,Thematic Curations,a multimedia exhibit,https://scalar.usc.edu/works/saint-domingue-lost-imperial-french-narratives-of-the-haitian-revolution/index,open,Stable,"en, fr",Andrew Blank Morgan Cornacchini  Nathan H. Dize Porter Geer Paul Miller Mikael Reijonen Claire Weinstein Elisabeth Zak,,"The Spring 2018 version of Vanderbilt’s FREN 3621: Enlightenment and Revolution course explores the historical forces, motivating ideas and consequences relating to the events of the French revolutionary period of 1789-1794 and the Haitian revolutionary period of 1791-1804.",,,,2020,,,
cds138,"Néhri, Chef des Haytiens",Thematic Curations,an online edition,https://kingdomofobjects.wordpress.com/,open,Stable,fr,"Tabitha McIntosh, Grégory Pierrot",,"In 1819, Haitian playwright, polemicist, journalist and statesman Juste Chanlatte published Néhri, Chef des Haytiens, his dramatized, fictionalized version of Haiti’s final victory over France. It has been presumed lost or unpublished for 200 years. Today it is back.",,Greg Pierrot,@wwjjddo,2020,,,
cds139,The Caribbean Commons,Cabinet of Wonders,a network,https://caribbean.commons.gc.cuny.edu/,open,Active,en,Kelly Baker Josephs,CUNY,"Begun in 2010 as part of the Caribbean Epistemologies Seminar at the CUNY Graduate Center, the Caribbean Commons publishes announcements of Caribbean Studies CFPs and publications, as well as Caribbean-related events in the Northeast US. It also archives information from the CE Seminar, 2010-12.",,Alex Gil,@elotroalex,2020,,,
cds14,Branding the Cuban Revolution,Thematic Curations,[digital collection],https://brandingrevolution.omeka.net/exhibits/show/branding-the-cuban-revolution,open,In Disrepair,en,"Steve Hyland, Jr.",,Reflections on the political messaging of the revolution to Cubans.,,Roopika Risam,@roopikarisam,2020,,,
cds140,The Falmouth Project,Maps & Visualizations,maps,https://falmouth.lib.virginia.edu/,open,Stable,en,Louis P. Nelson,"Scholars Lab, UVA","The town of Falmouth Jamaica has one of the richest collections of historic architecture in the Caribbean. This web site, the product of ten years on-site research, is a window into that architecture and its history.",,Roopika Risam,@roopikarisam,2020,,,
cds141,Slave Voyages,Reference,a database,https://www.slavevoyages.org/,open,Stable,"en,es, pt",Marcy Alexander,Emory University,"This digital memorial raises questions about the largest slave trades in history and offers access to the documentation available to answer them. European colonizers turned to Africa for enslaved laborers to build the cities and extract the resources of the Americas. They forced millions of Africans across the Atlantic to the Americas, and from one part of the Americas to another. Analyze these slave trades and view interactive maps, timelines, and animations to see the dispersal in action.",,,,2020,,,
cds142,The New Map of Empire,Maps & Visualizations,map,mapscholar.org/empire,open,Stable,en,S. Max Edelson and Bill Ferster,S. Max Edelson,"Maps and visualizations of the British Caribbean in the eighteenth century, with a special focus on the Ceded Islands. A digital map exhibition produced on MapScholar, and NEH-funded platform for geospatial visualization. Produced in tandem with Edelson, The New Map of Empire (Harvard, 2017)",,S. Max Edelson,@maxedelson,2020,"See especially the link to chapter 5, &quot; Charting Contested Caribbean Space&quot; ",,
cds143,"The Louis J. Boeri and Minín Bujones Boeri Collection of Cuban-American Radionovelas, 1963-1970",Thematic Curations,collection,https://digitallibrary.tulane.edu/islandora/object/tulane%3Aradionovelas,open,Stable,"en, es",,Howard-Tilton Memorial Library,"From his office and studios on the fifth floor of &quot; The Freedom Tower&quot;  in Miami, Italian-American businessman Louis J. Boeri and his company, America's Productions, Inc. (API), formed a radio programming empire, selling their shows to government, to more than 200 radio stations throughout Latin America and Spain, and to Spanish-speaking radio stations in the United States during the second half of the 1960s. With scripts written by acclaimed exiled Cuban screenwriters and Mexican writers, America's Productions, Inc. produced two types of programs: the first with political content and the second, of a more general nature, distinguished as &quot; pure entertainment.&quot;  Designed for a Latin American and Latino audience residing in the US, the pure entertainment included radio soap operas / dramas, comedies, advice and self-help programs, biblical dramas, mysteries, spy stories, and variety shows.",,,,2020,,,
cds144,Slave Trade of the MCC,Thematic Curations,collection,https://www.zeeuwsarchief.nl/en/zeeland-stories/trans-atlantic-slave-trade/slave-trade-of-the-mcc/,open,Stable,"en, nl",,,"The trading of Africans who were forced into slavery was the ‘core business’ of the MCC (The Middelburgse Commercie Compagnie). From 1732 to 1807, 31.095 African slaves were bought by the MCC with the intention to sell them in the West Indies. The archive of the MCC is kept by the Zeeland Archives and is included on UNESCO’s World Heritage List.",,,,2020,,,
cds145,The Caribbean Dictionary,Reference,dictionary,http://wiwords.com/,open,Stable,en,,,A dictionary of Caribbean English,,,,2020,,,
