pid,label,caridischo_genre,claimed_genre,link,access,status,language,creators,stewards,blurb,related_to,added_by,twitter,census_year,notes,sub_collections,open_data
cds4,Barbados Runaways,Thematic Curations,a platform,https://barbadosmercury.wordpress.com/,open,In Development,en,Early Caribbean Digital Archive; Amalia S. Levi,Early Caribbean Digital Archive,Companion site for public workshops around the &quot; Barbados Runaways&quot;  collection.,,Amalia S. Levi,@amaliasl,2020,,,
cds40,Digital Map of the Afro-Cuban Web,Maps & Visualizations,digital map,https://hcommons.org/deposits/item/hc:28035/,open,Stable,en,Maya Anderson-González,Humanities Commons,"Gephi visualization of a network of hyperlinks between websites related to Afro-Cuba containing 1486 nodes and 1703 edges, with size indicating degree",,Roopika Risam,@roopikarisam,2020,,,
cds41,Centro for Puerto Rican Studies Digital Collection,Digital Libraries,digital collection,https://centroca.hunter.cuny.edu/index.php,open,Stable,en,,Hunter College,"Centro is a research institute that is dedicated to the study and interpretation of the Puerto Rican experience in the United States and that produces and disseminates relevant interdisciplinary research. Centro also collects, preserves, and provides access to library resources documenting Puerto Rican history and culture.",,,,2020,,,
cds42,Archivo de Respuestas Emergencias de Puerto Rico (AREPR),Thematic Curations,archivo,http://arepr.org/,open,Active,"en, es",Christina Boyles,DLoC/Michigan State University,"Supported by the Andrew W. Mellon Foundation, the Archivo de Respuestas Emergencias de Puerto Rico (AREPR) is a freely available Omeka S site that depicts and describes the innovative knowledge production of grassroots community organizations in Puerto Rico in the wake of both natural and man-made disasters. The project involves collaboration between the University of Puerto Rico-Río Piedras, the University of Puerto Rico-Mayagüez, Michigan State University, and the Digital Library of the Caribbean.",cds31,Christina Boyles,@clboyles,2020,,,
cds43,dLOC as Data: A Thematic Approach to Caribbean Newspapers,Cabinet of Wonders,an initiative,http://dlocasdata.domains.uflib.ufl.edu/,open,In Development,en,"Perry Collins, Hadassah St. Hubert, Miguel Asencio, Jamie Rogers; http://dlocasdata.domains.uflib.ufl.edu/project-team/",Florida International University; University of Florida; Digital Library of the Caribbean,"Funded by the Collections as Data program with support from the Mellon Foundation, this project will enhance access to existing Caribbean newspaper digital collections by making texts available for bulk download to its users. This will facilitate modes of scholarship that depend on access to image and textual data at scale and will enable a new level of access to titles not included in newspaper data resources such as Chronicling America. To meet the needs of the dLOC community for teaching and research, we will demonstrate the potential of newspaper data by creating a pilot thematic tool kit focused on hurricanes and tropical cyclones.",cds31,Perry Collins,@perrycollins,2020,,,
cds44,Cuban Heritage Connection,Digital Libraries,digital collections,https://merrick.library.miami.edu/digitalprojects/chc.php,open,Active,"en, es",,University of Miami,"Below are descriptions and links to Cuban Heritage Collection digital collections with digital manuscripts, photographs, letters, maps and other resources held in the University of Miami Libraries Cuban Heritage Collection.",,Roopika Risam,@roopikarisam,2020,There are approximately infinity subcollections,,
cds45,Cuba Counterpoints,Publications & Blogs,a journal,cubacounterpoints.com,open,Archived,en,Ariana Hernandez-Reguant,Ariana H-R / Alan West-Duran,"Cuban Counterpoints is the public face of a scholarly community. It is a project linked to EthnoCuba, a network/group of Cubanist academics that includes residents from over fifteen countries, including Cuba and the United States.",,Ariana Hernandez-Reguant,,2020,💜,,
cds46,Claude McKay's Early Poetry (1911-1922): A Digital Collection,Scholarly Editions,digital collection,https://scalar.lehigh.edu/mckay/index,open,Stable,en,Amardeep Singh,Scalar,"This site began as a collaborative WordPress project put together by students in Amardeep Singh and Ed Whitley’s Introduction to the Digital Humanities graduate seminar. The site has evolved since fall 2015 and been reworked for the Scalar platform; it now offers digital editions of all of McKay’s early poems, including Songs of Jamaica, Constab Ballads, Spring in New Hampshire, and Harlem Shadows, as well as uncollected poetry published in various Jamaican, British, and American magazines from the 1910s and 20s not included in those volumes.",,Alex Gil,@elotroalex,2020,,,
cds47,Digital Archeological Archive of Comparative Slavery,Thematic Curations,digital archeological archive,https://www.daacs.org,open,Active,en,Jillian E. Galle,,"DAACS is a community resource, conceived and maintained in the Department of Archaeology at Monticello, in collaboration with the research institutions and archaeologists working throughout the Atlantic World.",,Kaiama L. Glover,@inthewhirld,2020,,,
cds48,Digital History at UWI: Hist 2807 Digital History Course,Reference,a syllabus,https://uwidigitalhistory.wordpress.com/instructor-information/,open,Stable,en,Debbie Mc Collin,UWI,"This is a course designed to pique your interest, hone your internet skills and sharpen your intellectual understanding of your field (both general history and Caribbean history) and its representation on the internet.",,Alex Gil,@elotroalex,2020,,,
cds49,Create Caribbean,Cabinet of Wonders,a digital humanities center,http://createcaribbean.org/create/,open,Active,en,Schuyler Esprit,,"Create Caribbean Inc. aims to develop the creative capacity of youth in Dominica and the Eastern Caribbean through a focus on education and research in the arts, humanities and social sciences. Our goal is to foster a culture of intellectual inquiry, encourage the use of digital technology in academic research, and increase outreach and community participation in the preservation and dissemination of Caribbean history, heritage and other research areas of significance.",,Alex Gil,@elotroalex,2020,,,
cds5,Alma Jordan Library Digital Collections,Digital Libraries,digital collections,https://uwispace.sta.uwi.edu/dspace/handle/2139/10,open,Active,en,,UWI - St. Augustine,This archive was established by the UWI Libraries to support the dissemination of knowledge by providing open access to the digitally preserved intellectual output of the University. Here we aim to collect together in one place the research and scholarship of members of the UWI community.,,Roopika Risam,@roopikarisam,2020,Herein lie subcollections,,
cds50,Documents from the History of the Dominican Republic,Scholarly Editions,project,https://www.marxists.org/history/dominican-republic/index.htm,open,Active,"en, es",Amaury Rodriguez,Marxists Internet Archive (MIA),"This project preserves Dominican history from below, left-wing revolutionary movements and class struggle via transcribed texts, translations and images.",,,,2020,,,
cds51,Cuban Theatre Digital Archives,Thematic Curations,digital archives,http://ctda.library.miami.edu/,open,Active,"en, es",Lillian Manzor et al.,University of Miami,"The Cuban Theater Digital Archive (CTDA) is a resource for research, teaching and learning in Cuban theater and performance as well as in related fields; a community repository for important Cuban theatrical materials; and a forum to foster scholarly communication in this field.",,Roopika Risam,@roopikarisam,2020,,,
cds52,Directorio de Afrocubanas,Reference,directorio,https://directoriodeafrocubanas.com/,open,Active,es,Sandra Alvarez,,"The Directory of Afrocubanas is a digital directory that collects files on Afro-descendant Cuban women, who have contributed significantly to national culture and history.",,,,2020,,,
cds53,"English Slave Trade, 1791-1799
(House of Lords Survey)",Thematic Curations,online data archive,https://www.disc.wisc.edu/archive/slave/slave05_index.html,open,Stable,en,Herbert S. Klein,University of Wisconsin - Madison Libraries,This site provides access to the raw data and documentation which contains information on English slave trade from 1791-1799.,,Roopika Risam,@roopikarisam,2020,,,
cds54,Digital Grainger,Scholarly Editions,an online edition,http://caribbeandigitalnyc.net/2020/,open,Stable,en,"Julie Chun Kim, Cristobal Silva, Alex Gil, Kimberly Takahata, Ami Yoon, Steve Fragano, Lina Jiang, and Elizabeth Cornell",,"The first edition of The Sugar-Cane, a 168-page poem about eighteenth-century Caribbean sugar plantations, appeared in London in 1764. We have created one full-text version of the poem and a page-by-page reading experience, as well as excerpts that highlight counter-plantation themes within the poem.",,Kaiama L. Glover,@inthewhirld,2020,,,
cds55,Dominica History: Building Communities 1838 – 1938,Thematic Curations,web resource,https://dominicahistory.org/2016/,open,Stable,en,Schuyler Esprit ,Create Caribbean,"The Dominica History web resource is a collaboration between the Division of Culture in Dominica and Create Caribbean Research Institute at Dominica State College. This year, the theme is “Building Communities: 1838-1938.”",,Schuyler Esprit ,@schuyleresprit,2020,,,
cds56,Caribbean Diaspora Project,Thematic Curations,a Digital Humanities initiative,caribbeandiasporaproject.org,open,Active,en,"Mirerza González-Vélez, Nadjah Ríos Villarini","dLoC, Puerto Rican Foundation for the Humanities","Caribbean Diasporas: Panorama of Carnival Practices is a Digital Humanities initiative by The Diaspora Project aiming to revitalize, reuse and recover primary and secondary sources, as well as artifacts, all related to carnival practices and mobility in the Caribbean.",cds31,Roopika Risam,@roopikarisam,2020,,,
cds57,Digital Photographic Archive of Historic Havana,Thematic Curations,digitial photographic archive,https://compass.fivecolleges.edu/collections/digital-photographic-archive-historic-havana,closed,Active,en,,,"Based on a common need for a robust infrastructure to manage their digital cultural heritage, Hampshire, Mount Holyoke, and Smith colleges together launched the Compass digital repository in June 2017. Compass supports our institutional missions of teaching and research excellence through improved access to unique materials, and creates a resource to engage both scholars and the general public. The colleges have partnered with Born-Digital for development, design, and project management support.",,Arturo Victoriano ,@ArturoVictoria4,2020,,,
cds58,Ecured,Reference,enciclopedia,https://www.ecured.cu/EcuRed,open,Stable,es,"Martín Campos, Javier",,"Collaborative encyclopedia on the Cuban network, in Spanish, born from the will to create and disseminate knowledge, with everyone and for everyone.",,,,2020,,,
cds59,The Gay Freedom Movement in Jamaica,Thematic Curations,collection,https://dloc.com/icirngfm,open,Stable,en,,,"The Gay Freedom Movement in Jamaica (GFM) was formed in September 1977 as the first movement in the English Speaking Caribbean to seek rights for LGBT (Lesbian, Gay, Bisexual and Transgendered) people",cds31,,,2020,,,
cds6,#ADPhD,Publications & Blogs,a curated blog,https://africandiasporaphd.com/,open,Active,en,Jessica Marie Johnson,,"African Diaspora, Ph.D. is a curated blog highlighting scholarship and scholars in the field of Atlantic African Diaspora history.",,Alex Gil,@elotroalex,2020,,,
cds60,Digital Aponte,Thematic Curations,a site,http://aponte.hosting.nyu.edu/,open,Stable,"en, es","Linda Rodriguez, Ada Ferrer, Kris Minhae Choe, Eric Anderson, et al",NYU,"Welcome to Digital Aponte, a site dedicated to the life and work of José Antonio Aponte, a free man of color, carpenter, artist, and alleged leader of a massive antislavery conspiracy and rebellion in colonial Cuba in 1811-1812.",,Alex Gil,@elotroalex,2020,,,
cds61,Ghosts in the Water: Chinese Women in Trinidad,Thematic Curations,a project,https://ghostsinthewater.wordpress.com/,open,Stable,en,Kimberly Bain,,"Focusing in on the Chinese female migrants who traveled to the island of Trinidad between 1860-1884, I will attempt help begin filling this gap, this lack of the female narrative.",,Roopika Risam,@roopikarisam,2020,,,
cds62,Dominica History: The Road To Independence ,Thematic Curations,digital archive,https://dominicahistory.org/start/,open,In Disrepair,en,Schuyler Esprit ,Create Caribbean,The Road to Independence is a multimedia web resource to celebrate Dominica’s 2015 History Week.,,Schuyler Esprit,@schuyleresprit,2020,,,
cds63,Dutch Caribbean Heritage Collection,Thematic Curations,collection,https://dcdp.uoc.cw/dutcarhercol,open,Stable,"en, es, du, pap",,,This Special Collection presents all unrestrictedly available digital material about the Dutch Caribbean published before 1954.,,,,2020,,,
cds64,In the Same Boats,Maps & Visualizations,maps,https://sameboats.org/,open,In Development,en,"Kaiama Glover, Alex Gil",,"In the Same Boats is a work of multimodal scholarship designed to encourage the collaborative production of humanistic knowledge within scholarly communities. The platform comprises two interactive visualizations that trace the movements of significant cultural actors from the Caribbean and wider Americas, Africa, and Europe within the 20th century Afro-Atlantic world. It presents opportunities for unearthing the extent to which Caribbean, Latin American, African, European, and Afro-American intellectuals have been in both punctual and sustained conversation with one another: attending the same conferences, publishing in the same journals and presses, active in the same political groups, perhaps even elbow-to-elbow in the same Parisian cafés and on the same transatlantic crossings––literally and metaphorically in the same boats––as they circulate throughout the Americas, Africa, Europe, and beyond.",,Alex Gil,@elotroalex,2020,,,
cds65,Early Caribbean Digital Archive,Scholarly Editions,digital archive,https://ecda.northeastern.edu,open,Active,en,"Nicole Aljoe, Elizabeth Dillon",Northeastern University,"The Early Caribbean Digital Archive is an open access collection of pre-twentieth-century Caribbean texts, maps, and images. Texts include travel narratives, novels, poetry, natural histories, and diaries that have not been brought together before as a single collection focused on the Caribbean.",,Kaiama L. Glover,@inthewhirld,2020,,,
cds66,Île en île,Reference,un site web,http://ile-en-ile.org/,open,Active,fr,Thomas C. Spear,CUNY,"Île en île is an open access, non-profit website intended to provide a rich documentation of French-speaking islands and to promote informative and non-commercial resources on the island world.",,Alex Gil,@elotroalex,2020,,,
cds67,Harlem Shadows,Scholarly Editions,edition,http://www.harlemshadows.org/,open,Stable,en,"Chris Forster, Roopika Risam",,This is an open-source edition of Claude McKay's 1922 collection of poems Harlem Shadows. It seeks to aggregate the most comprehensive set of documents related to Harlem Shadows and make them available to students and readers of McKay.,,Roopika Risam,@roopikarisam,2020,,,
cds68,Curaçao | History,Thematic Curations,a timeline,https://www.curacaohistory.com/,open,Stable,en,,Nationaal Archief Curaçao,"Experience the modern & ancient historic past events, people and governments of Curaçao",,,,2020,,,
cds69,Freedom to Believe,Cabinet of Wonders,project,https://www.freedomtobelieve.info/,open,Active,en,Diana Paton et al.,University of Edinburgh,"Welcome to Freedom to Believe, part of a theatre in education project exploring Caribbean social and religious histoires led by Diana Paton and funded by the Arts and Humanities Research Council.",,Roopika Risam,@roopikarisam,2020,,,
cds7,Banjology,Cabinet of Wonders,showcase,https://sites.duke.edu/banjology/the-banjo-in-haiti/,open,Stable,en,Laurent Dubois  David Garner  Mary Caton Lingold,Duke University,"The banjo has a rich history in the Caribbean, the region where we first find the traces of the instrument in the 17th century. Indeed, it seems that it is in the Caribbean that the instrument first emerged and was consolidated, for there is about a fifty year lag between the first sources we have describing the instrument in this region, from the 1680s, and those from North America, which are from the late 1730s. Here, we offer a few avenues for understanding the fascinating history of the banjo in the Caribbean.",,,,2020,,,
cds70,Aftermaths: Community Responses to Climate Disaster,Thematic Curations,a participatory public memory project,http://climatesofinequality.org/story/aftermaths-community-responses-to-climate-disaster/,open,In Development,"en, es",Ricia Chansky et al.,Climates of Inequality,Stories of Environmental Justice,,Roopika Risam,@roopikarisam,2020,,,
cds71,Fictions of the Haitian Revolution,Reference,online bibliography,http://haitianrevolutionaryfictions.com,open,Active,"en, fr",Marlene L. Daut,,An online bibliography of Haitian fiction from 1787 to 1899.,,Kaiama L. Glover,@inthewhirld,2020,,,
cds72,International Digital Ephemera Project: Cuban Ephemera,Thematic Curations,a collection,https://idep.library.ucla.edu/search#!/collection=Cuban+Ephemera,open,Stable,"es, en",,UCLA library,"The UCLA Library has launched an innovative and forward-looking initiative to capture ephemeral content with global partners. Through this project, UCLA Library endeavors to build international and global collections of knowledge and to preserve the historical and cultural record so that present and future generations can access and use ephemera that document the larger arena of discourse that takes place alongside mainstream media and scholarly publications.",,,,2020,,,
cds73,First Blacks in the Americas,Thematic Curations,a digital educational platform ,http://firstblacks.org/en/,open,Active,"en, es","Lisette Acosta, Dominican Studies Institute",CUNY,"First Blacks in the Americas is a fully bilingual (English and Spanish) digital educational platform devoted to disseminating sound historical information about the early presence of people of black African ancestry in the first colonial society of the Americas of modern times, the society of the colony named La Española (‘The Spanish One’) by the Spanish colonizers when they arrived in 1492 and throughout the sixteenth-century.",,Alex Gil,@elotroalex,2020,,,
cds74,Curaçao Nationaal Archief,Digital Libraries,een archief,https://www.nationaalarchief.cw/,open,Active,du,,National Archives of Curaçao,"A new voyage of discovery ... Search, browse and discover the original sources of Curaçao History.",,,,2020,,,
cds75,Indian Indenture,Maps & Visualizations,map,https://indianindenture.wordpress.com/,open,In Disrepair,en,Dhanashree Thorat,,"This project maps, spatially and chronologically, the migration of Indian indentured workers to Trinidad, one of the colonies to which a large number of indentured workers were sent. Between 1845 and 1917, about 143,900 indentured Indian labourers were sent to Trinidad.",,Roopika Risam,@roopikarisam,2020,,,
cds76,Jews of Barbados - Bibliography,Reference,online bibliography,https://www.zotero.org/groups/2333941/jews_of_barbados_-_bibliography,open,In Development,en,Amalia S. Levi,Amalia S. Levi,Bibliography (under construction) about the Jewish community of Barbados.,,Amalia S. Levi,@amaliasl,2020,,,
cds77,George Padmore Institute Archive,Thematic Curations,archive,https://www.georgepadmoreinstitute.org/,closed,Active,en,,George Padmore Institute,"The George Padmore Institute is an archive, educational resource and research centre housing materials relating to the black community of Caribbean, African and Asian descent in Britain and continental Europe.",,,,2020,,,
cds78,Ecologies Entrelacées,Thematic Curations,a digital humanities project,https://www.ecologiesentrelacees.com/,open,Active,"en, fr","Eirann Cohen, Rachel Kirk, Soraya Limare",,"A bilingual environmental digital humanities project that looks at gender and ecology in the Francophone Caribbean though the themes of sugar, bananas, beaches, and gardens.",,,,2020,,,
cds79,Haitian History Blog,Publications & Blogs,blog,https://haitianhistory.tumblr.com/,open,Active,en,,,"Welcome to the Haitian History Blog, a space dedicated to discussions on Haiti’s political history. “Political history” here can be understood in a broad sense, one that encompasses questions relating to society, governance, intellectual history and foreign relations forged between Haiti and its neighbours in the Americas.",,,,2020,,,
cds8,Biblioteca de Literatura Afrocolombiana,Thematic Curations,colección digital,http://babel.banrepcultural.org/digital/collection/p17054coll7,open,Stable,es,,"Ministry of Culture, Colombia","The Afro-Colombian Literature Library contains 18 titles and an essay written by prominent Afro-Colombian authors in the last 200 years; among them are the important works of authors such as: Manuel Zapata Olivella, Oscar Collazos, Helcías Martán Góngora, Arnoldo Palacios, Rogerio Velásquez, Candelario Obeso, among others.",,,,2020,,,
cds81,In Whispers and Furtive Glances: Assessing Cuban Digital Literacies and (H)ac(k)tivism in Post-Embargo Cuba,Cabinet of Wonders,a project proposal,https://marktriana.wixsite.com/whispersandglances,open,In Development,en,Mark Daniel Triana,,"&quot; In Whispers and Furtive Glances: Assessing Cuban Digital Literacies and (H)ac(k)tivism in Post-Embargo Cuba&quot;  is a prospective digital humanities project that discusses the ways in which Cuban peoples have cultivated a unique and compelling digital presence in the twenty-first century despite the many challenges that have been posed by surveillance, lack of material access, and severe network and hardware limitations.",,Roopika Risam,@roopikarisam,2020,,,
cds82,In All My Dreams,Cabinet of Wonders,exhibit,http://iamdbookclub.com,open,Active,en,"Kaiama L. Glover, Laurent Dubois",Barnard College,"The “In All My Dreams” book club, held from October 2019 to February 2020 was an informal gathering of readers interested in discovering or exploring Haitian culture through the prism of one of Haiti’s most important works of literary fiction.",,Kaiama L. Glover,@inthewhirld,2020,😍,,
cds83,Haiti and the Atlantic World,Thematic Curations,website,https://haitidoi.com/,open,Stable,en,Julia Gaffield,,This website seeks to encourage the discussion about Haiti’s founding documents and their influences on the broader Atlantic.,,Alex Gil,@elotroalex,2020,,,
cds84,John Carter Brown Library Haiti Collection,Thematic Curations,digital collection,https://archive.org/details/jcbhaiti,open,Active,"en, fr",,Brown University,"Our rare books, maps and newspapers tell the story of the founding of the French colony of Saint Domingue (once the most lucrative colony in the Americas), its demise through the Haitian Revolution (the world's only successful slave revolution) and the founding of Haiti in its place.",,Roopika Risam,@roopikarisam,2020,,,
cds85,Guantánamo Public Memory Project,Cabinet of Wonders,a project,https://gitmomemory.org/stories/,open,Active,en,Columbia University Center for the Study of Human Rights,Columbia University Center for the Study of Human Rights,What can we learn from GTMO’s past? What should we remember about what’s happening now? Hear from those who were there.,,Roopika Risam,@roopikarisam,2020,,,
cds86,Haiti an Island Luminous,Thematic Curations,a site ,http://islandluminous.fiu.edu/index-english.html,open,Stable,en,Adam M. Silvia and Brooke Wooldridge ,FIU,"An Island Luminous is a site to help readers learn about Haiti’s history. Created by historian Adam M. Silvia and hosted online by Digital Library of the Caribbean, An Island Luminous combines rare books, manuscripts, and photos scanned by archives and libraries in Haiti and the United States with commentary by over one hundred (100) authors from universities around the world.",,Alex Gil,@elotroalex,2020,,,
cds87,Mapping Marronage,Maps & Visualizations,maps,http://mapping-marronage.rll.lsa.umich.edu/,open,Active,en,Annette Joseph-Gabriel,University of Michigan,"Mapping Marronage is an interactive visualization of the trans-Atlantic networks of intellectual, creative and political exchange created by enslaved people in the 18th and 19th century. It traces the geographic reach, crossings and intersections of letters, testimonies and financial exchanges by enslaved people of African-descent.",,Roopika Risam,@roopikarisam,2020,,,
cds88,Musical Passage,Scholarly Editions,exhibit,http://www.musicalpassage.org/,open,Active,en,"Mary Caton Lingold, David Garner, Laurent Dubois","Scholars & Publics, Duke University","Developed by historian Laurent Dubois, PhD candidate in English Mary Caton Lingold, and composer-scholar David Garner, Musical Passage uses a digital format to explore a unique artifact of early African diasporic music. The site is designed around two pages from eighteenth-century British naturalist and collector Hans Sloane’s A Voyage to the Islands (1707), which documents his time in Jamaica in the late 1680s. The pages of Voyage that have been placed at the center of this site present notation of songs played at a “festival.” This material is precious and fascinating, representing the earliest notation we have of music produced by enslaved Africans in the Caribbean or North America. The performers whose music is represented and interpreted here were likely survivors of the Middle Passage who may have been playing music they had learned in their homelands. They may also have been in the process of creating entirely new performance traditions.",,Alex Gil,@elotroalex,2020,Can't copy text from the original site.,,
